<?xml version="1.0" encoding="UTF-8"?>
<!-- example of a Sgam.eXchange - file
/*******************************************************************************
* Copyright (c) 2006, G. Weirich and Sgam.informatics
* All rights reserved. This program and the accompanying materials
* are made available under the terms of the Eclipse Public License v1.0
* which accompanies this distribution, and is available at
* http://www.eclipse.org/legal/epl-v10.html
*
* Contributors:
*    G. Weirich - initial implementation
*    
*  $Id: EMRSample.xml 1292 2006-11-19 09:55:29Z rgw_ch $
*******************************************************************************/
-->
<XCHANGE xmlns="SgamXChange" xmlns:xsi="http://www.w3.org/2001/XMLSchema-instance"
	xsi:schemaLocation="SgamXChange xchange.xsd">
	<!--xsi:schemaLocation="SgamXChange SgamXChange.xsd" -->
	<!-- Deklaration der verwendeten eXChange Version und des Erstellers der Datei, sowie 
	des Datums, an dem diese Datei erstellt wurde und eine eindeutige ID-->
	<document version="0.1.0" creatorName="elexis" creatorID="www.elexis.ch"
		date="2006-10-18" id="1bc12434521" responsible="007"/>
	
	<contact type="person" lastname="Testperson" middlename="X."
		firstname="Armeswesen" birthdate="1950-10-12" sex="male"
		id="165.23.456.212">
		
		<address type="default">
			<street>DieseGasse 27</street>
			<zip>9999</zip>
			<city>Elexikon</city>
			<country>CH</country>
			<phone>555-123456</phone>
		</address>
		
		<connection type="mobile" identification="555-99123"/>
		<connection type="e-mail" identification="testperson@armeswesen.ch"/>
		<connection type="skype" identification="armtestwesen"/>
		<connection type="web"
			identification="http://www.testperson-armeswesen.ch"/>
		
		<address type="work">
			<street>Hauptstrasse 27</street>
			<zip>8888</zip>
			<city>Anderswo</city>
		</address>
		<contactref type="spouse" id="165.23.456.23"/>
		
		<medical>
			<!-- anamnestic episodes -->
			<anamnesis>
				<!-- a single episode -->
				<episode date="2005-10-15" title="Tibiafraktur"
					inactive="2005-12-10" id="234">
					<diagnosis codesystem="ICD-10" code="Z00"/>
					<text>Beim Skifahren rechtes Bein gebrochen</text>
				</episode>
				<episode date="2003-12-01" title="Hypertonie" id="567">
					<diagnosis codesystem="TICode" code="A00"/>
					<text>Essentielle Hypertonie</text>
				</episode>
			</anamnesis>
			<!-- collection of all medical records -->
			<records>
				<record date="2006-08-24" author="gerry" responsible="0de122333"
					id="0ab12UUID">
					<text>Dies ist ein unstrukturierter KG-Eintrag.</text>
					<episode id="234"/>
					
				</record>
				<record date="2006-08-30" author="gerry" responsibleEAN="012333"
					id="0ab13UUID">
					<text>
						<section name="Subjektiv">Dies ist ein strukturierter
							KG-Eintrag</section>
						<section name="Objektiv"></section>
						<section name="Beurteilung">Heute alles in Butter</section>
						<section name="Procedere"></section>
					</text>
					<episode id="234"/>
					<episode id="567"/>
				</record>
				
			</records>
			
			<!-- collection of all analyses. Every analyse comes from a specified institution, and the Result can be normal,
			abnormal or indeterminate 
			-->
			<analyses>
				<!-- An Analyse classified according LOINC -->
				<analyse classification="LOINC" lab="3425" param="2828-2"
					date="2006-07-23" abnormal="false">
					<result>3.8</result>
				</analyse>
				
				
				<!-- An analyse whose result can be expressed as number within or outside a norm range -->
				<analyse classification="lab" date="2006-08-24" lab="122345"
					param="Hb" type="number" normRange="10.0-15.0" unit="mmol/l"
					abnormal="true">
					<result>9.2</result>
				</analyse>
				
				
				<!-- An analyse whose result is an unstructured text. The text itself is referenced externally -->
				<analyse date="2006-08-24" lab="122345" param="Sputumzytologie"
					type="docref" id="doc001" abnormal="false" classification="lab"/>
				
				<!-- An analyse whose result is either positive or negative -->
				<analyse date="2006-08-24" lab="122345" param="HIV suchtest"
					type="absolute" abnormal="false" classification="lab">
					<result>negativ</result>
				</analyse>
				
				<!-- Some analyses whose results can be viewed as images -->
				<analyse date="2006-09-19" classification="lab" lab="122345"
					param="Eiweiss-Elektrophorese" type="docref" id="doc002"
					abnormal="true">
					<result>Hypalbuminämie</result>
				</analyse>
				
				<analyse classification="lab" date="2006-08-24" lab="122345"
					type="docref" param="MRI Gehirn" id="doc003" abnormal="false">
					<result>unauffällig</result>
				</analyse>
				
				<analyse classification="lab" date="2006-08-24" lab="012333"
					abnormal="false" param="EKG" type="docref" id="doc004">
					<result>nc SR, LLT, unauff. de- undRepol. </result>
				</analyse>
				
				<!-- An analyse with a nested image which is enclosed base64 encoded. An application that is not able to display images is 
				adviced to ignore the image silently and show only the text -->
				<analyse classification="lab" date="2006-08-24" lab="012333"
					param="Rx Thorax pa und seitlich" abnormal="true" id="344554">
					<image id="rqwerq§4qwreqr" content="inline" hint="ignore">
						1245123534534523656463456#xD;
						4564576376765767675675675#xD;
						5675675675676656756745675#xD;
						qwerqwrterwztzruzejuezuzu#xD; </image>
					<result>Infiltrat li Oberlappen</result>
				</analyse>
				
			</analyses>
			
			<!-- collection of all documents concerning this patient exchanged between
			the creator of the document and other institutions or persons. A document can be of
			any mime-type, which must be declared as type-attribute -->
			
			<documents>
				<!-- A document which is a picture -->
				<document date="2006-02-20" type="image/jpeg"
					title="Nävus am rechten Vorderarm" id="12234432" content="ext"
					origin="007" record="0ab12UUID">
					<summary>Auffälliger Nävus zur Verlaufskontrolle</summary>
				</document>
				
				<!-- an outgoing document -->
				<document date="2006-08-24" type="application/msword" dest="23234"
					title="Anmeldung ergometrie" id="0982423UUID" content="ext"
					record="0ab12UUID"
					hint="replace: Anmeldung Kardiologie KSSH"/>
				
				<!-- Some analyses (referenced from analyses - Block)  -->
				<document date="2006-08-24" id="doc001" type="text/plain"
					origin="122345" title="Sputumzytologie" content="ext"
					hint="ignore"/>
				
				<document date="2006-06-19" type="image/png" content="ext"
					id="doc002" title="Eiweiss-Elektrophorese"/>
				
				<document date="2006-08-24" id="doc003" type="image/DICOM"
					content="ext" title="MRI Gehirn"
					hint="warn: Bild kann nicht angezeigt werden"/>
				
				<document date="2006-08-24" type="image/jpeg" id="doc004"
					content="ext" title="Ruhe-EKG"
					hint="warn: Bild kann nicht angezeigt werden"/>
				
			</documents>
			<medications>
				<medication id="1124324534" substance="metoprololi"
					start="2006-01-01" last="2006-05-06" dosage="1-0-0">Beloc ZOK
					100mg</medication>
				<medication id="7680519460224"
					substance="Quinalaprilum,Hydrochlorothiazidum"
					start="2006-02-05" last="2006-06-08" dosage="1-0-0">Accuretic
					20/12.5</medication>
			</medications>
			<allergies>
				<allergy substance="acidum acetylsalicylicum" first="2005-01-04"
					confirmed="no">ASS</allergy>
				<allergy substance="wasp" first="2004-08-12" confirmed="yes">
					Wespenstich</allergy>
			</allergies>
		</medical>
	</contact>
	
	<contact type="organization" name="SWICA Gesundheitsorganisation"
		id="7601003002041">
		<address type="work">
			<street>Bahnhofstrasse 8</street>
			<zip>8200</zip>
			<city>Schaffhausen</city>
		</address>
	</contact>
	
	<contact type="person" lastname="Busch" middlename="Dabbeljuh"
		firstname="Dschordsch" birthdate="1941-06-06" id="007" title="presi"
		salutation="Mistärr">
	</contact>
	
	<contact type="person" lastname="Testerella" firstname="Kunigunde"
		birthdate="1955-03-08" id="165.23.456.23">
		<address type="home">
			<street>Marktstrasse 7</street>
			<zip>D-992344</zip>
			<city>Deutschhausen</city>
		</address>
	</contact>
	
	<contact type="organization" name="Labor Prof. Dr. V. Ampir" id="122345">
		<address type="default">
			<street>Hintergasse 27</street>
			<zip>9998</zip>
			<city>Ost-Elexikon</city>
			<phone>555-123456</phone>
		</address>
		<connection type="fax" identification="555-999888"/>
		<connection type="fernabfrage"
			identification="https://www.vampir.ch/befunde"/>
	</contact>
	
</XCHANGE>